{"$schema":"./project-links.schema.json","schema_version":1,"captured_at":"2026-08-04T19:00:00Z","schedule":{"timezone":"America/Chicago","local_time":"03:00"},"projects":[{"key":"3fa-app","github":{"organization":"3FA-app","project_number":1,"project_title":"3FA-app-project"},"linear":{"project_name":"github.com/3FA-app"},"chatgpt":{"project_name":"3fa-app"},"slack":{"channel_name":"#3fa-app"}},{"key":"agent-pontifex","github":{"organization":"agent-pontifex","project_number":1,"project_title":"agent-pontifex-project"},"linear":{"project_name":"github.com/agent-pontifex"},"chatgpt":{"project_name":"agent-pontifex"},"slack":{"channel_name":"#agent-pontifex"}},{"key":"akrion-sim","github":{"organization":"akrion-sim","project_number":1,"project_title":"akrion-sim-project"},"linear":{"project_name":"github.com/akrion-sim"},"chatgpt":{"project_name":"akrion-sim"},"slack":{"channel_name":"#akrion-sim"}},{"key":"anticaptrad","github":{"organization":"anticaptrad","project_number":1,"project_title":"anticaptrad-project"},"linear":{"project_name":"github.com/anticaptrad"},"chatgpt":{"project_name":"anticaptrad"},"slack":{"channel_name":"#anticaptrad"}},{"key":"athlet-o","github":{"organization":"athlet-o","project_number":1,"project_title":"athlet-o-project"},"linear":{"project_name":"github.com/athlet-o"},"chatgpt":{"project_name":"athlet-o"},"slack":{"channel_name":"#athlet-o"}},{"key":"benefactor-cc","github":{"organization":"benefactor-cc","project_number":1,"project_title":"benefactor-cc-project"},"linear":{"project_name":"github.com/benefactor-cc"},"chatgpt":{"project_name":"benefactor-cc"},"slack":{"channel_name":"#benefactor-cc"}},{"key":"canonical-cloud","github":{"organization":"canonical-cloud","project_number":1,"project_title":"canonical-cloud-project"},"linear":{"project_name":"github.com/canonical-cloud"},"chatgpt":{"project_name":"canonical-cloud"},"slack":{"channel_name":"#canonical-cloud"}},{"key":"channelsiege","github":{"organization":"channelsiege","project_number":1,"project_title":"channelsiege-project"},"linear":{"project_name":"github.com/channelsiege"},"chatgpt":{"project_name":"channelsiege"},"slack":{"channel_name":"#channelsiege"}},{"key":"claritas-viz","github":{"organization":"claritas-viz","project_number":1,"project_title":"claritas-viz-project"},"linear":{"project_name":"github.com/claritas-viz"},"chatgpt":{"project_name":"claritas-viz"},"slack":{"channel_name":"#claritas-viz"}},{"key":"cliptown","github":{"organization":"cliptown","project_number":1,"project_title":"cliptown-project"},"linear":{"project_name":"github.com/cliptown"},"chatgpt":{"project_name":"cliptown"},"slack":{"channel_name":"#cliptown"}},{"key":"daedalus-fab","github":{"organization":"daedalus-fab","project_number":1,"project_title":"daedalus-fab-project"},"linear":{"project_name":"github.com/daedalus-fab"},"chatgpt":{"project_name":"daedalus-fab"},"slack":{"channel_name":"#daedalus-fab"}},{"key":"dancing-dragons","github":{"organization":"dancing-dragons","project_number":4,"project_title":"dancing-dragons-project"},"linear":{"project_name":"github.com/dancing-dragons"},"chatgpt":{"project_name":"dancing-dragons"},"slack":{"channel_name":"#dancing-dragons"}},{"key":"declarative-migrations","github":{"organization":"declarative-migrations","project_number":1,"project_title":"declarative-migrations-project"},"linear":{"project_name":"github.com/declarative-migrations"},"chatgpt":{"project_name":"declarative-migrations"},"slack":{"channel_name":"#declarative-migrations"}},{"key":"discrete-event-systems","github":{"organization":"discrete-event-systems","project_number":1,"project_title":"discrete-event-systems-project"},"linear":{"project_name":"github.com/discrete-event-systems"},"chatgpt":{"project_name":"discrete-event-systems"},"slack":{"channel_name":"#discrete-event-systems"}},{"key":"drone-mngr","github":{"organization":"drone-mngr","project_number":1,"project_title":"drone-mngr-project"},"linear":{"project_name":"github.com/drone-mngr"},"chatgpt":{"project_name":"drone-mngr"},"slack":{"channel_name":"#drone-mngr"}},{"key":"fanwaave","github":{"organization":"fanwaave","project_number":1,"project_title":"fanwaave-project"},"linear":{"project_name":"github.com/fanwaave"},"chatgpt":{"project_name":"fanwaave"},"slack":{"channel_name":"#fanwaave"}},{"key":"fiducia-cloud","github":{"organization":"fiducia-cloud","project_number":1,"project_title":"fiducia-cloud-project"},"linear":{"project_name":"github.com/fiducia-cloud"},"chatgpt":{"project_name":"fiducia-cloud"},"slack":{"channel_name":"#fiducia-cloud"}},{"key":"fifa-math","github":{"organization":"fifa-math","project_number":1,"project_title":"fifa-math-project"},"linear":{"project_name":"github.com/fifa-math"},"chatgpt":{"project_name":"fifa-math"},"slack":{"channel_name":"#fifa-math"}},{"key":"file-tunnel","github":{"organization":"file-tunnel","project_number":1,"project_title":"file-tunnel-project"},"linear":{"project_name":"github.com/file-tunnel"},"chatgpt":{"project_name":"file-tunnel"},"slack":{"channel_name":"#file-tunnel"}},{"key":"gha-indie-worker","github":{"organization":"gha-indie-worker","project_number":1,"project_title":"gha-indie-worker-project"},"linear":{"project_name":"github.com/gha-indie-worker"},"chatgpt":{"project_name":"gha-indie-worker"},"slack":{"channel_name":"#gha-indie-worker"}},{"key":"hypeblitz","github":{"organization":"hypeblitz","project_number":1,"project_title":"hypeblitz-project"},"linear":{"project_name":"github.com/hypeblitz"},"chatgpt":{"project_name":"hypeblitz"},"slack":{"channel_name":"#hypeblitz"}},{"key":"hypesiege","github":{"organization":"hypesiege","project_number":1,"project_title":"hypesiege-project"},"linear":{"project_name":"github.com/hypesiege"},"chatgpt":{"project_name":"hypesiege"},"slack":{"channel_name":"#hypesiege"}},{"key":"memebank","github":{"organization":"memebank","project_number":1,"project_title":"memebank-project"},"linear":{"project_name":"memebank"},"chatgpt":{"project_name":"memebank"},"slack":{"channel_name":"#memebank"}},{"key":"messaging-intel","github":{"organization":"messaging-intel","project_number":1,"project_title":"messaging-intel-project"},"linear":{"project_name":"github.com/messaging-intel"},"chatgpt":{"project_name":"messaging-intel"},"slack":{"channel_name":"#messaging-intel"}},{"key":"meta-agents-demo","github":{"organization":"meta-agents-demo","project_number":1,"project_title":"meta-agents-demo-project"},"linear":{"project_name":"meta-agents-demo"},"chatgpt":{"project_name":"meta-agents-demo"},"slack":{"channel_name":"#meta-agents-demo"}},{"key":"networking-components","github":{"organization":"networking-components","project_number":1,"project_title":"networking-components-project"},"linear":{"project_name":"github.com/networking-components"},"chatgpt":{"project_name":"networking-components"},"slack":{"channel_name":"#networking-components"}},{"key":"omniblitz","github":{"organization":"OmniBlitz","project_number":1,"project_title":"OmniBlitz-project"},"linear":{"project_name":"github.com/OmniBlitz"},"chatgpt":{"project_name":"omniblitz"},"slack":{"channel_name":"#omniblitz"}},{"key":"opto-sync","github":{"organization":"opto-sync","project_number":1,"project_title":"opto-sync-project"},"linear":{"project_name":"github.com/opto-sync"},"chatgpt":{"project_name":"opto-sync"},"slack":{"channel_name":"#opto-sync"}},{"key":"quaestor-ledger","github":{"organization":"quaestor-ledger","project_number":1,"project_title":"quaestor-ledger-project"},"linear":{"project_name":"github.com/quaestor-ledger"},"chatgpt":{"project_name":"quaestor-ledger"},"slack":{"channel_name":"#quaestor-ledger"}},{"key":"rust-ssr-demos","github":{"organization":"rust-ssr-demos","project_number":1,"project_title":"rust-ssr-demos-project"},"linear":{"project_name":"github.com/rust-ssr-demos"},"chatgpt":{"project_name":"rust-ssr-demos"},"slack":{"channel_name":"#rust-ssr-demos"}},{"key":"sagitta-stack","github":{"organization":"sagitta-stack","project_number":1,"project_title":"sagitta-stack-project"},"linear":{"project_name":"github.com/sagitta-stack"},"chatgpt":{"project_name":"sagitta-stack"},"slack":{"channel_name":"#sagitta-stack"}},{"key":"scintilla-run","github":{"organization":"scintilla-run","project_number":1,"project_title":"scintilla-run-project"},"linear":{"project_name":"github.com/scintilla-run"},"chatgpt":{"project_name":"scintilla-run"},"slack":{"channel_name":"#scintilla-run"}},{"key":"shared-auth","github":{"organization":"shared-auth","project_number":1,"project_title":"shared-auth-project"},"linear":{"project_name":"github.com/shared-auth"},"chatgpt":{"project_name":"shared-auth"},"slack":{"channel_name":"#shared-auth"}},{"key":"sonus-auris","github":{"organization":"sonus-auris","project_number":1,"project_title":"sonus-auris-project"},"linear":{"project_name":"github.com/sonus-auris"},"chatgpt":{"project_name":"sonus-auris"},"slack":{"channel_name":"#sonus-auris"}},{"key":"streamkore","github":{"organization":"streamkore","project_number":1,"project_title":"streamkore-project"},"linear":{"project_name":"github.com/streamkore"},"chatgpt":{"project_name":"streamkore"},"slack":{"channel_name":"#streamkore"}},{"key":"streempilot","github":{"organization":"StreemPilot","project_number":1,"project_title":"StreemPilot-project"},"linear":{"project_name":"github.com/streempilot"},"chatgpt":{"project_name":"streempilot"},"slack":{"channel_name":"#streempilot"}},{"key":"unreal-unity-poc","github":{"organization":"unreal-unity-poc","project_number":1,"project_title":"unreal-unity-poc-project"},"linear":{"project_name":"github.com/unreal-unity-poc"},"chatgpt":{"project_name":"unreal-unity-poc"},"slack":{"channel_name":"#unreal-unity-poc"}},{"key":"usa-acc","github":{"organization":"usa-acc","project_number":1,"project_title":"usa-acc-project"},"linear":{"project_name":"github.com/usa-acc"},"chatgpt":{"project_name":"usa-acc"},"slack":{"channel_name":"#usa-acc"}},{"key":"voxletra","github":{"o